"Rank","NCT Number","Title","Acronym","Status","Study Results","Conditions","Interventions","Outcome Measures","Sponsor/Collaborators","Gender","Age","Phases","Enrollment","Funded Bys","Study Type","Study Designs","Other IDs","Start Date","Primary Completion Date","Completion Date","First Posted","Results First Posted","Last Update Posted","Locations","Study Documents","URL"
689,"NCT00870818","Protege Extension Trial - Long Term Follow Up Trial for Subjects Who Completed the Protege Study (CP-MGA031-01)",,"Terminated","No Results Available","Type 1 Diabetes Mellitus","Drug: Teplizumab","Primary outcome measures will include the number and percentage of subjects who experience a SAE, Adverse Event of Special Interest (including Opportunistic Infection, Lymphopoliferative disease), or other Immediately Reportable Event.|A secondary endpoint will be determining the efficacy of teplizumab by measuring the subject's total daily insulin usage and HbA1c levels.|C-peptide secretory response will be analyzed in terms of basal levels of C-peptide produced before a mixed meal and stimulated levels after a mixed meal, measured as AUC and peak post-meal production.|Immunophenotyping of blood mononuclear cells will be summarized by visit and graphed over time, as appropriate.|A secondary efficacy endpoint will be assessing Heath Related Quality of Life Questionnaires filled out by subjects at different timepoints in the study.","MacroGenics|Eli Lilly and Company","All","10 Years to 37 Years   (Child, Adult)","Phase 2|Phase 3","219","Industry","Interventional","Allocation: Randomized|Intervention Model: Parallel Assignment|Masking: Quadruple (Participant, Care Provider, Investigator, Outcomes Assessor)|Primary Purpose: Treatment","CP-MGA031-02","February 2009","February 2011","May 2011","March 27, 2009","null","March 8, 2012","Atlanta Diabetes Associates, Atlanta, Georgia, United States","","https://ClinicalTrials.gov/show/NCT00870818"
690,"NCT00866710","Behavioral Therapy to Treat Urinary Incontinence in Parkinson's Disease","BETTUR PD","Completed","No Results Available","Urinary Incontinence|Parkinson's Disease","Other: Exercise-based behavioral therapy","Bladder diary|Quality of Life Questionnaire","Atlanta VA Medical Center|The John A. Hartford Foundation","All","50 Years and older   (Adult, Older Adult)","Not Applicable","28","U.S. Fed|Other","Interventional","Intervention Model: Single Group Assignment|Masking: None (Open Label)|Primary Purpose: Treatment","6-38941","October 2008","October 2011","October 2011","March 20, 2009","null","January 12, 2012","Atlanta VA Medical Center, Atlanta, Georgia, United States","","https://ClinicalTrials.gov/show/NCT00866710"
691,"NCT00864370","Bipolar Disorder (BPD) in Pregnancy: Predictors of Morbidity",,"Completed","No Results Available","Pregnancy|Bipolar Disorder","","To determine if psychiatric morbidity among pregnant women with BPD is greatest for those who receive suboptimal pharmacotherapy, have a more severe past illness-course, or have experienced recent psychosocial stressors.","Emory University|Massachusetts General Hospital|The Cleveland Clinic","Female","18 Years to 45 Years   (Adult)","","237","Other","Observational","Observational Model: Cohort|Time Perspective: Prospective","IRB00046058|R01MH071531|Bipolar Disorder in Pregnancy","May 2005","January 2011","June 2013","March 18, 2009","null","November 13, 2013","Emory University Department of Psychiatry & Behavioral Sciences, Atlanta, Georgia, United States","","https://ClinicalTrials.gov/show/NCT00864370"
692,"NCT00863889","Steroid Injection for the Treatment of Greater Trochanteric Pain Syndrome",,"Withdrawn","No Results Available","Bursitis","Drug: Depomedrol injection|Drug: Lidocaine, Marcaine","WOMAC hip score","Emory University","All","17 Years and older   (Child, Adult, Older Adult)","Phase 4","0","Other","Interventional","Allocation: Randomized|Intervention Model: Parallel Assignment|Masking: Single (Participant)|Primary Purpose: Treatment","IRB00010776","March 2009","February 2010","February 2010","March 18, 2009","null","September 23, 2013","Dr. Tom Bradbury, Atlanta, Georgia, United States","","https://ClinicalTrials.gov/show/NCT00863889"
693,"NCT00862056","Detection of Subclinical Atherosclerosis in Asymptomatic Individuals","Decide CTA","Completed","No Results Available","Coronary Artery Disease","Procedure: Cardiac CT","The primary endpoint of the study is identifying the prevalence of coronary artery disease (CAD) in an asymptomatic population of patients without prior history of, but with high likelihood of CAD.","Piedmont Healthcare","All","35 Years to 90 Years   (Adult, Older Adult)","","73","Other","Observational","Observational Model: Cohort|Time Perspective: Prospective","PH08012","January 2009","July 2013","July 2013","March 16, 2009","null","November 20, 2017","Piedmont Hospital, Atlanta, Georgia, United States","","https://ClinicalTrials.gov/show/NCT00862056"
694,"NCT00861653","Atherosclerotic Plaque Characterization","APC","Completed","No Results Available","Atherosclerosis","","Characterization of plaque that is found in the carotid walls of patients who have atherosclerosis|To evaluate the effectiveness of MR imaging in identifying these plaque characteristics","Piedmont Healthcare","All","18 Years and older   (Adult, Older Adult)","","50","Other","Observational","Observational Model: Ecologic or Community|Time Perspective: Prospective","P06-31","October 2006","August 2011","July 2013","March 13, 2009","null","April 15, 2014","Piedmont Hospital, Atlanta, Georgia, United States","","https://ClinicalTrials.gov/show/NCT00861653"
695,"NCT00861575","Cardiogenomics Registry","CGR","Completed","No Results Available","Cardiovascular Disease","","To assess the relationship of multiple phenotypes and genotypes with cardiovascular disease|To assess the impact of phenotypes and genotypes of specific patient subgroups (gender, ethnic, family history) on cardiovascular disease","Piedmont Healthcare","All","18 Years to 99 Years   (Adult, Older Adult)","","2601","Other","Observational","Observational Model: Cohort|Time Perspective: Prospective","PH05005","February 2006","February 2012","February 2012","March 13, 2009","null","November 20, 2017","Piedmont Hospital, Atlanta, Georgia, United States","","https://ClinicalTrials.gov/show/NCT00861575"
696,"NCT00860327","Examining Developmental Changes in Heart Contractions of Children With Congenital Heart Defects",,"Terminated","No Results Available","Hypoplastic Left Heart Syndrome|Tetralogy of Fallot","","Calcium handling assay","Emory University|National Heart, Lung, and Blood Institute (NHLBI)","All","up to 1 Year   (Child)","","375","Other|NIH","Observational","Observational Model: Cohort|Time Perspective: Prospective","IRB00007244|R01HL088488","December 2007","June 2016","June 2016","March 12, 2009","null","August 22, 2016","Emory University, Department of Pediatrics, Atlanta, Georgia, United States","","https://ClinicalTrials.gov/show/NCT00860327"
697,"NCT00851162","Using Mesenchymal Stem Cells to Fill Bone Void Defects in Patients With Benign Bone Lesions",,"Withdrawn","No Results Available","Bone Neoplasms","Biological: Trinity multipotent stem cells|Biological: Demineralized bone matrix(DBM)","Time to fill bony defect|Adverse reaction from bone graft","Emory University","All","11 Years and older   (Child, Adult, Older Adult)","Phase 2|Phase 3","0","Other","Interventional","Allocation: Randomized|Intervention Model: Single Group Assignment|Masking: Single (Participant)|Primary Purpose: Treatment","IRB00009762","March 2009","March 2010","March 2010","February 25, 2009","null","November 28, 2012","Emory University, Atlanta, Georgia, United States","","https://ClinicalTrials.gov/show/NCT00851162"
698,"NCT00850720","Study of Possible Brain Hormone Problems After Open Heart Surgery in Infants",,"Terminated","Has Results","Congenital Heart Disease","Other: Blood draws","NO Outcomes - Study Terminated Without Data.","Emory University|Children's Healthcare of Atlanta","All","up to 1 Year   (Child)","","3","Other","Observational","Observational Model: Case-Only|Time Perspective: Prospective","IRB00007443","March 2009","October 2009","October 2009","February 25, 2009","January 7, 2014","January 7, 2014","Children's Healthcare of Atlanta at Egleston, Atlanta, Georgia, United States","","https://ClinicalTrials.gov/show/NCT00850720"
699,"NCT00846404","Markers of Oxidative Stress Diastolic Dysfunction","ODDS","Unknown status","No Results Available","Diastolic Heart Failure|Diastolic Dysfunction","","Evidence of diastolic dysfuntion documented by echocardiography with six months before the time of enrollment.|This study is observational. It entails measurement products from a blood draw.","Emory University","All","18 Years to 65 Years   (Adult, Older Adult)","","50","Other","Observational","Observational Model: Case Control|Time Perspective: Prospective","730-2006","July 2006","May 2007","July 2010","February 18, 2009","null","February 18, 2009","Atlanta VAMC, Decatur, Georgia, United States","","https://ClinicalTrials.gov/show/NCT00846404"
700,"NCT00838331","Adverse Effects of RBC Transfusions: A Unifying Hypothesis","INOBA","Completed","Has Results","Healthy Volunteers","Biological: Fresh blood|Biological: Aged blood","The Effects of Storage-related RBC Changes on Acetylcholine-stimulated (NO-mediated) Forearm Blood Flow.","Emory University","All","21 Years to 80 Years   (Adult, Older Adult)","Phase 2","24","Other","Interventional","Intervention Model: Single Group Assignment|Masking: None (Open Label)|Primary Purpose: Treatment","IRB00015316","April 2009","May 2013","October 2013","February 6, 2009","March 6, 2015","March 6, 2015","Emory University, Atlanta, Georgia, United States","","https://ClinicalTrials.gov/show/NCT00838331"
701,"NCT00837512","Insulin Delivery Using Microneedles in Type 1 Diabetes",,"Completed","Has Results","Type 1 Diabetes Mellitus","Device: Microneedle|Device: Subcutaneous insulin catheter","Onset Time (Tmax)","Emory University|Thrasher Research Fund","All","8 Years to 18 Years   (Child, Adult)","Phase 2|Phase 3","16","Other","Interventional","Allocation: Randomized|Intervention Model: Crossover Assignment|Masking: None (Open Label)|Primary Purpose: Treatment","1348-2005|FWA00005792","September 2008","December 2012","July 2013","February 5, 2009","January 8, 2014","January 8, 2014","Emory University, Atlanta, Georgia, United States","","https://ClinicalTrials.gov/show/NCT00837512"
702,"NCT00837330","Ranibizumab (Lucentis) for Polypoidal Choroidal Vasculopathy",,"Completed","Has Results","Polypoidal Choroidal Vasculopathy","Drug: ranibizumab 0.5 or 0.3 mg/0.05 cc","Commonly Reported and Notable Adverse Events","Southeast Retina Center, Georgia|Genentech, Inc.","All","35 Years and older   (Adult, Older Adult)","Phase 1|Phase 2","20","Other|Industry","Interventional","Allocation: Non-Randomized|Intervention Model: Parallel Assignment|Masking: None (Open Label)|Primary Purpose: Treatment","FVF3761s","May 2006","December 2010","December 2010","February 5, 2009","June 23, 2014","December 3, 2014","Southeast Retina Center, Augusta, Georgia, United States","","https://ClinicalTrials.gov/show/NCT00837330"
703,"NCT00833651","Protective Immunity Project 02","PIP-02","Completed","No Results Available","Kidney Transplant|Immunology|Immunosuppression","","To determine the effect of immunosuppressive regimens on the magnitude and character of the adaptive immune response to flu vaccine|To determine the effects of chronic immunosuppressive therapies on innate immunity during response to flu vaccine|To define the transcriptional and protein signatures of the response to flu vaccination in patients on conventional immunosuppressive regimens compared to healthy volunteers","Emory University","All","18 Years to 59 Years   (Adult)","","97","Other","Observational","Observational Model: Cohort|Time Perspective: Prospective","IRB00024793|PIP-02","November 2006","February 2010","October 2011","February 2, 2009","null","November 25, 2013","Emory University, Atlanta, Georgia, United States","","https://ClinicalTrials.gov/show/NCT00833651"
704,"NCT00833430","Avascular Necrosis (AVN) Long-Term Follow-up",,"Terminated","No Results Available","Avascular Necrosis|Femoral Head Collapse","","Safety, Efficacy and longevity of device with patient as opposed to conventional total hip replacement","Zimmer Biomet","All","18 Years to 75 Years   (Adult, Older Adult)","","35","Industry","Observational","","IC006-99","June 2006","February 2013","February 2013","February 2, 2009","null","February 19, 2016","Emory Orthopedic Clinic, Atlanta, Georgia, United States","","https://ClinicalTrials.gov/show/NCT00833430"
705,"NCT00833144","Bedside Ultrasound Identifies Congestive Heart Failure",,"Completed","No Results Available","Heart Failure|Dyspnea","","sensitivity and specificity of the ultrasound lung rockets to predict congestive heart failure|comparison of the BNP with the thoracic ultrasound findings","Emory University","All","18 Years and older   (Adult, Older Adult)","","375","Other","Observational","Observational Model: Case Control|Time Perspective: Prospective","IRB00015895|2008125","February 2009","February 2010","February 2011","January 30, 2009","null","December 13, 2013","Grady Memorial Hospital, Atlanta, Georgia, United States","","https://ClinicalTrials.gov/show/NCT00833144"
706,"NCT00829036","Wayfinding Information Access System for People With Vision Loss",,"Completed","Has Results","Blindness","Device: Wayfinding Prototype","Mean Percent (Prototype / Baseline) Time","US Department of Veterans Affairs|VA Office of Research and Development","All","18 Years and older   (Adult, Older Adult)","Not Applicable","24","U.S. Fed","Interventional","Intervention Model: Single Group Assignment|Masking: None (Open Label)","C6690-R","October 2012","December 2012","December 2012","January 26, 2009","April 2, 2014","April 2, 2014","Atlanta VA Medical and Rehab Center, Decatur, Decatur, Georgia, United States","","https://ClinicalTrials.gov/show/NCT00829036"
707,"NCT00827099","Umbilical Cord Blood (UCB) Transplant, Fludarabine, Melphalan, and Anti-thymocyte Globulin (ATG) in Treating Patients With Hematologic Cancer",,"Terminated","Has Results","Myeloproliferative Disorders|Leukemia|Lymphoma|Multiple Myeloma and Plasma Cell Neoplasm|Myelodysplastic Syndromes","Biological: anti-thymocyte globulin|Drug: fludarabine phosphate|Drug: Melphalan|Drug: mycophenolate mofetil|Drug: tacrolimus|Procedure: umbilical cord blood transplantation","Number of Participants With 100 Day Transplant-related Mortality (TRM)|Number of Patients That Engrafted Blood Counts by 30 Days After Transplant|Percentage of Donor and Host Chimerism of Each Cord Blood Unit|Number of Patients Who Experience Acute and Chronic Graft-vs-host Disease After Transplant.|Number of Patients Who Experience Disease Relapse Post-transplant|Number of Patients Who Survive Following Treatment on This Protocol","Northside Hospital, Inc.","All","18 Years to 65 Years   (Adult, Older Adult)","Phase 2","5","Other","Interventional","Intervention Model: Single Group Assignment|Masking: None (Open Label)|Primary Purpose: Treatment","CDR0000632453|BMTGG-NSH-801","June 2006","November 2009","November 2009","January 22, 2009","August 3, 2011","March 23, 2012","Blood and Marrow Transplant Group of Georgia, Atlanta, Georgia, United States","","https://ClinicalTrials.gov/show/NCT00827099"
708,"NCT00823264","Phenytoin and Multidose Activated Charcoal",,"Completed","Has Results","Phenytoin Toxicity","Drug: Activated Charcoal","Time of Elimination of Phenytoin in Patients With Elevated Phenytoin Levels","Emory University","All","18 Years and older   (Adult, Older Adult)","Not Applicable","17","Other","Interventional","Allocation: Randomized|Intervention Model: Parallel Assignment|Masking: None (Open Label)|Primary Purpose: Treatment","IRB00008017","August 2008","July 2010","January 2012","January 15, 2009","September 11, 2014","September 11, 2014","Grady Memorial Hospital, Atlanta, Georgia, United States","","https://ClinicalTrials.gov/show/NCT00823264"
709,"NCT00818961","Donor Stem Cell Transplant in Treating Patients With High-Risk Hematologic Cancer",,"Terminated","Has Results","Leukemia|Lymphoma|Myelodysplastic Syndromes|Myelodysplastic/Myeloproliferative Diseases","Biological: alemtuzumab|Biological: graft-versus-tumor induction therapy|Biological: rituximab|Drug: busulfan|Drug: cyclophosphamide|Drug: fludarabine phosphate|Drug: methotrexate|Drug: tacrolimus|Procedure: allogeneic bone marrow transplantation","Survival at Day 100|Overall Survival at 1 Year|Non-relapse Mortality at Day 100|Non-relapse Mortality at 1 Year Post-transplant|Complete Donor Chimerism|Neutrophil Recovery|Platelet Engraftment|Number of Patients Requiring the Use of Donor Leukocyte Infusion (DLI) for Early Mixed T-cell Chimerism|Number of Patients Experiencing Grade 2-4 Acute Graft-versus-host Disease Post-transplant|Number of Patients Experiencing Chronic Graft Versus Host Disease|Number of Patients Experiencing Veno-occlusive Disease (VOD) Post-transplant","Northside Hospital, Inc.|Blood and Marrow Transplant Group of Georgia","All","40 Years to 72 Years   (Adult, Older Adult)","Phase 2","36","Other","Interventional","Intervention Model: Single Group Assignment|Masking: None (Open Label)|Primary Purpose: Treatment","CDR0000630617|BMTGG-NSH-756","May 2005","March 2011","March 2012","January 8, 2009","December 18, 2013","December 18, 2013","Blood and Marrow Transplant Group of Georgia, Atlanta, Georgia, United States","","https://ClinicalTrials.gov/show/NCT00818961"
710,"NCT00817102","Validation of Stenosis Assessment by Coronary Artery Computed Tomography Against Invasive Measurements of Fractional Flow Reserve in Patients With Significant Coronary Artery Stenoses",,"Completed","No Results Available","Coronary Artery Stenosis","Procedure: FFR, IVUS, VH, or combination of the three","The CT-derived endpoints: Study lesion %DS predicting FFR<0.75; %AS predicting FFR<0.75; MLD predicting FFR<0.75; Study lesion MLA predicting FFR<0.75; IVUS-derived endpoints: Study lesion MLD predicting FFR<0.75; MLA predicting FFR<0.75","Piedmont Healthcare","All","21 Years to 85 Years   (Adult, Older Adult)","Not Applicable","25","Other","Interventional","Intervention Model: Single Group Assignment|Masking: None (Open Label)|Primary Purpose: Diagnostic","ATLANTA II","November 2008","November 2011","April 2013","January 6, 2009","null","April 15, 2014","Piedmont Hospital, Atlanta, Georgia, United States","","https://ClinicalTrials.gov/show/NCT00817102"
711,"NCT00808041","Chemotherapy Monitoring With Breast Computed Tomography (CT)",,"Completed","No Results Available","Breast Cancer","Device: Dedicated breast computed tomography imaging","Tumor response","Emory University|National Institutes of Health (NIH)","Female","18 Years and older   (Adult, Older Adult)","","3","Other|NIH","Observational","Observational Model: Case-Only|Time Perspective: Prospective","IRB00012068|1P50CA128301-01A1","July 2009","September 2012","July 2015","December 15, 2008","null","July 23, 2015","Emory University Winship Cancer Institute, Atlanta, Georgia, United States","","https://ClinicalTrials.gov/show/NCT00808041"
712,"NCT00795262","Effects of Quinapril 40 mg With Alpha Lipoic Acid or Placebo on Diabetes and Hypertension","QUALITY","Completed","No Results Available","Diabetes|Hypertension","Drug: Quinapril (Accupril) plus Alpha Lipoic Acid|Drug: accupril, placebo|Drug: accupril, alpha lipoic acid","Comparison of relative change of systolic BP/diastolic BP and urinary albumin excretion from baseline in diabetic patients treated with quinapril plus lipoic acid versus quinapril and placebo.|Comparison of patients treated with quinapril plus lipoic acid versus quinapril plus placebo in the following areas: a) Changes from baseline in high sensitivity C-reactive protein, adiponectin, and leptin","InVasc Therapeutics, Inc.","All","18 Years to 75 Years   (Adult, Older Adult)","Not Applicable","23","Industry","Interventional","Allocation: Randomized|Intervention Model: Crossover Assignment|Masking: Quadruple (Participant, Care Provider, Investigator, Outcomes Assessor)|Primary Purpose: Treatment","INV-064 QUALITY","July 2008","July 2009","July 2009","November 21, 2008","null","May 5, 2011","Atlanta Vascular Research Foundation, Tucker, Georgia, United States","","https://ClinicalTrials.gov/show/NCT00795262"
713,"NCT00793884","Emory Latino Diabetes Education Program","ELDEP","Recruiting","No Results Available","Diabetes","","To describe the social and demographic characteristics of the Latino population with diabetes mellitus in Georgia|To examine barriers to health care among Latinos with Diabetes in the population we serve|To determine differences in clinical outcomes (hemoglobin A1C, waist circumference, BMI, blood pressure) and diabetes self-management behaviors between initial and follow-up data","Emory University|Sanofi|Eli Lilly and Company|Takeda|Novo Nordisk A/S","All","18 Years and older   (Adult, Older Adult)","","800","Other|Industry","Observational","Observational Model: Cohort|Time Perspective: Prospective","IRB00013340","October 2008","December 2018","December 2018","November 19, 2008","null","October 12, 2017","Emory University School of Medicine, Atlanta, Georgia, United States","","https://ClinicalTrials.gov/show/NCT00793884"
714,"NCT00793650","Combination High Dose Melphalan and Autologous Peripheral Blood Stem Cell (PBSC) Transplant With Bortezomib for Multiple Myeloma: A Dose and Schedule Finding Study",,"Terminated","Has Results","Cancer|Multiple Myeloma","Drug: Bortezomib|Drug: Melphalan|Procedure: Autologous PBSC Transplant","Safety and Engraftment|Response Rate Using EBMT(European Group for Blood and Bone Marrow Transplan) Criteria at Day +100 After Transplant.","Emory University|Millennium Pharmaceuticals, Inc.","All","18 Years and older   (Adult, Older Adult)","Phase 1|Phase 2","39","Other|Industry","Interventional","Allocation: Randomized|Intervention Model: Parallel Assignment|Masking: None (Open Label)|Primary Purpose: Treatment","080-2005","May 2005","October 2009","September 2011","November 19, 2008","June 18, 2012","August 30, 2012","Emory University Winship Cancer Institute, Atlanta, Georgia, United States","","https://ClinicalTrials.gov/show/NCT00793650"
715,"NCT00788320","Vitamin D in Active Tuberculosis (TB) Study",,"Withdrawn","No Results Available","Tuberculosis","Drug: Vitamin D3|Drug: Placebo","LL-37 level|Sputum Conversion|25-hydroxyvitamin D and serum calcium","Atlanta VA Medical Center","All","18 Years and older   (Adult, Older Adult)","Not Applicable","0","U.S. Fed","Interventional","Allocation: Randomized|Intervention Model: Single Group Assignment|Masking: Quadruple (Participant, Care Provider, Investigator, Outcomes Assessor)|Primary Purpose: Treatment","Vitamin D in TB","October 2008","February 2010","February 2010","November 10, 2008","null","January 20, 2012","Emory University, Atlanta, Georgia, United States","","https://ClinicalTrials.gov/show/NCT00788320"
716,"NCT00788138","Effects of Vitamin D Supplementation on Lung Function in an Acute Pulmonary Exacerbation of Cystic Fibrosis",,"Completed","No Results Available","Cystic Fibrosis","Dietary Supplement: Vitamin D3|Dietary Supplement: Placebo","Vitamin D status measured by serum 25-hydroxyvitamin D|Antimicrobial peptide levels of LL-37, an endogenous anti-microbial peptide in humans|Markers of pulmonary function measured by FEV1 % predicted|Length of hospitalization measured in days|Number of days on antibiotic therapy","Emory University|Atlanta VA Medical Center","All","18 Years to 70 Years   (Adult, Older Adult)","Not Applicable","30","Other","Interventional","Allocation: Randomized|Intervention Model: Single Group Assignment|Masking: Triple (Participant, Investigator, Outcomes Assessor)|Primary Purpose: Treatment","Inpatient Vitamin D in CF","October 2008","September 2010","September 2010","November 10, 2008","null","October 11, 2010","Emory University, Atlanta, Georgia, United States","","https://ClinicalTrials.gov/show/NCT00788138"
717,"NCT00788021","Protective Immunity Project 01","PIP-01","Completed","No Results Available","Kidney Transplantation|Immunity|Immunosuppression","","To determine the effects of chronic immunosuppressive therapies on adaptive immunity|To determine the effects of chronic immunosuppressive therapies on innate immunity, dendritic cell phenotype and function and TLR signaling|To define the transcriptional signatures associated with specific immunosuppressive regimens","Emory University","All","18 Years to 59 Years   (Adult)","","124","Other","Observational","Observational Model: Cohort|Time Perspective: Prospective","IRB00000709|PIP-01","September 2006","January 2011","October 2011","November 10, 2008","null","November 25, 2013","Emory University, Atlanta, Georgia, United States","","https://ClinicalTrials.gov/show/NCT00788021"
718,"NCT00787904","Role of T-cells in Post-Menopausal Osteoporosis",,"Completed","Has Results","Osteoporosis","","Changes in T-cell Activation Measured by Flow Cytometry, Specifically the Percentage of CD3+CD69+ T-cells|Percent Change in Thymus Size Measured by CT Scan|Bone Mineral Density","Atlanta VA Medical Center|Emory University","All","18 Years to 55 Years   (Adult)","","19","U.S. Fed|Other","Observational","Observational Model: Case Control|Time Perspective: Prospective","T-cells in osteoporosis","December 2006","June 2011","December 2012","November 10, 2008","December 13, 2016","December 13, 2016","Emory University, Atlanta, Georgia, United States","","https://ClinicalTrials.gov/show/NCT00787904"
