"Rank","NCT Number","Title","Acronym","Status","Study Results","Conditions","Interventions","Outcome Measures","Sponsor/Collaborators","Gender","Age","Phases","Enrollment","Funded Bys","Study Type","Study Designs","Other IDs","Start Date","Primary Completion Date","Completion Date","First Posted","Results First Posted","Last Update Posted","Locations","Study Documents","URL"
207,"NCT02720198","Levomilnacipran ER vs. Adjunctive Quetiapine for Adults With Inadequate Relief With SSRIs in MDD",,"Completed","No Results Available","Major Depressive Disorder","Drug: Levomilnacipran|Drug: Quetiapine","Changes of Montgomery-Åsberg Depression Rating Scale (MADRS) total score|Response Rate|Remission Rate|Changes in neurocognition by changes in Scores on Reyes Verbal Learning Test|Changes in neurocognition by changes in Scores on Clinical Global Impression Scale- Severity (CGI-S)|Changes in neurocognition by changes in Scores on Clinical Global Impression Scale- Severity (CGI-I)|Changes in scores on Hamilton Anxiety Rating Scale (HAM-A) scores|Changes in scores on Sheehan Disability Scale (SDS) total score|Changes in neurocognition by changes in scores on Scores on Digit symbol substitution test (DSST)|Changes in scores on Apathy Evaluation Scale (AES).|Changes in neurocognition by changes in scores on Improvement (CGI-I) scores","Duke University|Forest Laboratories|Institute for Advanced Medical Research, Alpharetta, GA","All","18 Years to 65 Years   (Adult, Older Adult)","Phase 3","60","Other|Industry","Interventional","Allocation: Randomized|Intervention Model: Parallel Assignment|Masking: Triple (Participant, Investigator, Outcomes Assessor)|Primary Purpose: Treatment","Pro00064983","January 23, 2017","June 12, 2018","June 12, 2018","March 25, 2016","null","June 19, 2018","Institute for Advanced Medical Research, Alpharetta, Georgia, United States","","https://ClinicalTrials.gov/show/NCT02720198"
208,"NCT02712346","The Role of Endothelin-1 in Sickle Cell Disease",,"Recruiting","No Results Available","Sickle Cell Anemia","Drug: Ambrisentan|Drug: Placebo","Safety and Tolerability of ambrisentan in patients with sickle cell disease measured by physical exam, vital signs, blood and urine testing, ECG (specified visits), concomitant medication review, adverse events review|Efficacy of ambrisentan in improving kidney function in patients with sickle cell disease measured by blood|Efficacy of ambrisentan in decreasing TRJ velocity|Efficacy of ambrisentan in decreasing inflammation|Efficacy of ambrisentan in improving micro-circulation|Efficacy of ambrisentan in improving macro-circulation|Efficacy of ambrisentan in improving nociception/pain|Efficacy of ambrisentan in improving kidney function in patients with sickle cell disease measured by urine testing for microalbuminuria/proteinuria","Augusta University|Gilead Sciences|National Heart, Lung, and Blood Institute (NHLBI)","All","18 Years to 65 Years   (Adult, Older Adult)","Phase 1","30","Other|Industry|NIH","Interventional","Allocation: Randomized|Intervention Model: Parallel Assignment|Masking: Triple (Participant, Care Provider, Investigator)|Primary Purpose: Treatment","Endothelin|5U01HL117684","September 2015","May 2018","May 2018","March 18, 2016","null","June 29, 2017","Augusta University, Augusta, Georgia, United States","","https://ClinicalTrials.gov/show/NCT02712346"
209,"NCT02712281","Autism MEAL Plan: Parent Training to Manage Eating Aversions & Limited Variety",,"Completed","No Results Available","Autism Spectrum Disorder","Behavioral: Autism MEAL Plan|Behavioral: Parent Education","Change in Clinical Global Impression - Improvement scale (CGI-I) score|Change in Parenting Stress Index- Short Form (PSI) score|Parent Satisfaction Rating|Change in Brief Autism Mealtime Behavior Inventory (BAMBI) scores|Change in Food Preference Inventory (FPI) scores|Change in nutritional intake|Change in Aberrant Behavior Checklist (ABC) scores|Change in rapid acceptance during 10 minute meal observation|Change in rapid swallowing during 10-minute meal observation|Change in disruptions during 10-minute meal observation|Change in crying during 10-minute meal observation|Change in volume of food consumed during 10-minute meal observation|Weight|Height|Body Mass Index","Emory University|Children's Healthcare of Atlanta","All","3 Years to 8 Years   (Child)","Not Applicable","37","Other","Interventional","Allocation: Randomized|Intervention Model: Parallel Assignment|Masking: Single (Outcomes Assessor)|Primary Purpose: Treatment","IRB00085811","July 2016","March 2018","April 2018","March 18, 2016","null","May 8, 2018","Marcus Autism Center, Atlanta, Georgia, United States","","https://ClinicalTrials.gov/show/NCT02712281"
210,"NCT02709083","Dasatinib or Nilotinib Followed by Imatinib in Patients With Newly Diagnosed, Chronic Phase Chronic Myeloid Leukemia",,"Recruiting","No Results Available","Chronic Myelogenous Leukemia|Chronic Myeloid Leukemia|Leukemia","Drug: Dasatinib|Drug: Imatinib Mesylate|Drug: Nilotinib","The proportion of subjects who achieve major molecular response (MMR)|Accelerated phase (AP) or blast phase (BP) free survival|Change in PRO score extracted from the MD Anderson Symptom Inventory-Chronic Myelogenous Leukemia (CML)|Duration of adverse events (AEs) using the Common Terminology Criteria for Adverse Events (CTCAE) v4.03 criteria|Frequency of adverse events (AEs) using the Common Terminology Criteria for Adverse Events version 4.03 (CTCAE v4.03) criteria|Progression free survival (PFS)|Severity of adverse events (AEs) using the Common Terminology Criteria for Adverse Events (CTCAE) v4.03 criteria|The number of subjects with breakpoint cluster region-abelson murine leukemia viral oncogene homolog 1 (BCR-ABL1) transcript levels ≤ deep molecular responses (MR⁴)","Emory University","All","17 Years and older   (Child, Adult, Older Adult)","Phase 2","100","Other","Interventional","Intervention Model: Single Group Assignment|Masking: None (Open Label)|Primary Purpose: Treatment","IRB00087045|NCI-2016-00162|Winship3143-16","October 2016","October 2019","October 2023","March 15, 2016","null","November 1, 2017","Emory University/Winship Cancer Institute, Atlanta, Georgia, United States","","https://ClinicalTrials.gov/show/NCT02709083"
211,"NCT02706977","The Effect of Dopamine on Diabetic Retinopathy","Dopamine DR","Enrolling by invitation","No Results Available","Diabetes","Drug: Low Dose Sinemet CR|Drug: High Dose Sinemet CR|Device: RETeval Electroretinogram (ERG) Testing|Other: Contrast Sensitivity Testing|Other: Visual Acuity Testing","Change in Retinal Function assessed by Electroretinogram (ERG) Device|Change in Contrast Sensitivity assessed by the Contrast Sensitivity Function v1.0 (CSF v1.0) Tablet Application|Change in Contrast Sensitivity assessed by the Sine Wave Grafting Test (CSV-1000E)|Change in Visual Acuity assessed by the Standard Snellen Static Chart","Emory University","All","18 Years to 80 Years   (Adult, Older Adult)","Phase 1","45","Other","Interventional","Allocation: Randomized|Intervention Model: Parallel Assignment|Masking: Double (Participant, Investigator)|Primary Purpose: Treatment","IRB00083672","January 2016","December 2018","December 2018","March 11, 2016","null","January 8, 2018","Atlanta VA Medical Center, Atlanta, Georgia, United States","","https://ClinicalTrials.gov/show/NCT02706977"
212,"NCT02703532","Evaluation of a CarePartner-Integrated Telehealth Rehabilitation Program for Persons With Stroke","CARE-CITE","Recruiting","No Results Available","Stroke","Behavioral: CARE-CITE Education Program|Behavioral: Traditional Education|Behavioral: Constraint-Induced Movement Therapy (CIMT)","Change in Motor Ability and Impairments assessed by the Wolf Motor Function Test (WMFT)|Change in Upper Extremity Function and Use assessed by the Motor Activity Log (MAL)|Change in Family Conflict assessed by the Family Caregiver Conflict Scale (FCCS-F)|Change in Depression Status assessed by the Center for Epidemiologic Studies Depression Scale (CES-D)|Change in the Autonomy Support Family Care Climate Questionnaire for Stroke Survivor (FCC-SS) Score|Change in Upper Extremity Impairment assessed by the Fugl-Meyer Assessment (FMA)|Change in Upper Extremity Self-Efficacy assessed by the Confidence in Arm and Hand (CAHM) Scale|Change in Quality of Life assessed by the Stroke Impact Scale (SIS)|Change in the Family Assessment Device (FAD) Scale Score|Change in the Memory and Behavior Problems Checklist (MBPC) Score|Change in the Autonomy Support Family Care Climate Questionnaire for Stroke Survivor (FCC-CP) Scale Score|Change in Fatigue Level assessed by the Piper Fatigue Scale (PFS)|Change in Caregiver Strain assessed by the Caregiver Strain Index (CSI)|Change in Bakas Caregiving Outcomes Scale (BCOS) Score|Change in Caregiving Self Efficacy (Respite Scale) Score|Change in Modified Computer Self Efficacy Scale (CSES) Score|Change in Post Study System Usability Questionnaire (PSSUQ) Score","Emory University","All","18 Years and older   (Adult, Older Adult)","Not Applicable","96","Other","Interventional","Allocation: Randomized|Intervention Model: Parallel Assignment|Masking: Single (Outcomes Assessor)|Primary Purpose: Supportive Care","IRB00070957","January 2016","March 2019","March 2019","March 9, 2016","null","September 18, 2018","Emory University Hospital, Atlanta, Georgia, United States","","https://ClinicalTrials.gov/show/NCT02703532"
213,"NCT02702921","Powered Vascular Stapler in Video-Assisted Thoracoscopic (VAT) Lobectomies",,"Completed","Has Results","Non Small Cell Lung Cancer","Device: Surgeon's 'standard of care' stapler|Device: Ethicon Powered Vascular Stapler","Incidence of Intra-Operative Hemostatic Intervention|Post-operative Interventions or Procedures Related to Pulmonary Artery or Pulmonary Vein Bleeding","Ethicon Endo-Surgery","All","18 Years and older   (Adult, Older Adult)","Not Applicable","201","Industry","Interventional","Allocation: Randomized|Intervention Model: Parallel Assignment|Masking: None (Open Label)|Primary Purpose: Treatment","ESC-15-001","February 1, 2016","March 31, 2017","March 31, 2017","March 9, 2016","June 29, 2018","October 11, 2018","Emory University, Atlanta, Georgia, United States","""Study Protocol"", https://ClinicalTrials.gov/ProvidedDocs/21/NCT02702921/Prot_000.pdf|""Statistical Analysis Plan"", https://ClinicalTrials.gov/ProvidedDocs/21/NCT02702921/SAP_001.pdf","https://ClinicalTrials.gov/show/NCT02702921"
214,"NCT02700841","Enhancing Anti-Myeloma Vaccine Response After Autologous Stem Cell Transplantation",,"Suspended","No Results Available","Plasma Cell Myeloma","Drug: Melphalan|Procedure: Peripheral Blood Stem Cell Transplantation--CD34 HSCT|Procedure: Peripheral Blood Stem Cell Transplantation--AHSCT|Biological: T Cell-Depleted Hematopoietic Stem Cell Transplantation|Biological: Tetanus Toxoid Vaccine|Biological: Therapeutic Autologous Lymphocytes|Biological: Trivalent Influenza Vaccine|Biological: XBP1-US/XBP1-SP/CD138/CS1 Multipeptide Vaccine PVX-410","Change in influenza antibody titer as measured by hemagglutination inhibition assay (HAI)|Change in absolute lymphocyte count (ALC)|Change in immune cells (T cells cluster of differentiation 8 [CD8], CD4)|Change in NK cells|Change in XBP1-US/XBP1-SP/CD138/CS1 multipeptide vaccine PVX-410 (PVX-410) tetramer+/interferon (IFN) gamma+ cell levels|Changes in absolute monocyte counts (AMC)|Engraftment time|Functional benefit of depleting immune suppressive cells from granulocyte-colony stimulating factor (G-CSF) (filgrastim) mobilized autologous peripheral blood stem grafts|Incidence of auto immune side effects using the National Cancer Institute Common Terminology Criteria for Adverse Events version 4.02|Incidence of infections|Progression-free survival","Emory University|OncoPep, Inc.","All","18 Years to 70 Years   (Adult, Older Adult)","Phase 2","26","Other|Industry","Interventional","Allocation: Randomized|Intervention Model: Parallel Assignment|Masking: None (Open Label)|Primary Purpose: Treatment","IRB00079982|NCI-2015-00743|WINSHIP2905-15","May 2016","December 1, 2018","December 1, 2019","March 7, 2016","null","February 21, 2018","Emory University/Winship Cancer Institute, Atlanta, Georgia, United States","","https://ClinicalTrials.gov/show/NCT02700841"
215,"NCT02696044","Treatment of Mitochondrial Dysfunction in Rett Syndrome With Triheptanoin",,"Recruiting","No Results Available","Rett Syndrome","Drug: triheptanoin","Change in Clinical Seizure Frequency|Change in Dystonia frequency|Change in Dystonia Severity|Change in Burke-Fahn-Marsden Dystonia Rating Scale (BFM) Score|Change in Global Dystonia Rating Scale (GDRS) Score|Change in the PROMIS Fatigue Parent Proxy Score|Change in the PROMIS Pain Interference Parent Proxy Score|Change in the PROMIS Peer Relations Parent Proxy Score|Change in the PROMIS Physical Functional Mobility Parent Proxy Score|Change in the PROMIS Physical Function Upper Extremity Parent Proxy Score|Change in the PROMIS Anxiety Parent Proxy Score|Change in the PROMIS Depressive Symptoms Parent Proxy Score|Change in Child Health Questionnaire-50 (CHQ) Score|Change in the Clinician Clinical Global Impression - Improvement Scale (CGI-S) Score|Change in the Clinician Clinical Global Impression - Severity Scale Score|Change in the Parental Clinical Global Impression of Improvement Score|Change in Parent Top Three Concerns Visual Analog Scale Ranking|Change in the Clinical Severity Scale (CSS) Score|Change in the Motor Behavioral Assessment (MBA) Score|Change in the Rett Syndrome Behavioural Questionnaire (RSBQ) Score|Change in the Rett Syndrome Hand Apraxia Scale (RHAS) Score|Change in the Rett Syndrome Gross Motor Scale (RSGMS) Score|Change in Maximum Heart Rate as assessed by the Graded Maximal Treadmill Test|Change in Maximum Speed Acheived as assessed by the Graded Maximal Treadmill Test|Frequency of Epileptiform Electroencephalogram (EEG) Activity|Seizure Activity assessed by Change in Photoplethysmographic Heart Rate|Change in Daily 3-axis accelerometry|Seizure Activity assessed by Change in Electrodermal Activity (EDA)|Seizure Activity assessed by Change in Skin Temperature","Center for Rare Neurological Diseases, Norcross, GA|Ultragenyx Pharmaceutical Inc|Rett Syndrome Research Trust","Female","2 Years and older   (Child, Adult, Older Adult)","Phase 2","12","Other|Industry","Interventional","Allocation: Non-Randomized|Intervention Model: Single Group Assignment|Masking: None (Open Label)|Primary Purpose: Treatment","IRB00085194","June 2016","February 2019","February 2019","March 2, 2016","null","February 7, 2018","Center for Rare Neurological Diseases, Norcross, Georgia, United States","","https://ClinicalTrials.gov/show/NCT02696044"
216,"NCT02694666","Vibration Training for Preventing Falls in Healthy Population and Multiple Sclerosis",,"Recruiting","No Results Available","Falls Prevention","Other: Controlled whole-body vibration training","Real life falls|Berg Balance Scale test|Slip-related falls on treadmill|Functional mobility|Sensation|Muscle strength|Range of motion|Bone density|Multiple Sclerosis Functional Composite score|Equiscale balance test","Georgia State University","All","18 Years to 75 Years   (Adult, Older Adult)","Not Applicable","440","Other","Interventional","Allocation: Randomized|Intervention Model: Parallel Assignment|Masking: Triple (Participant, Investigator, Outcomes Assessor)|Primary Purpose: Prevention","514810","April 2015","June 2019","June 2020","February 29, 2016","null","July 31, 2018","Georgia State University, Atlanta, Georgia, United States","","https://ClinicalTrials.gov/show/NCT02694666"
217,"NCT02691221","ReliefLink: A Preventative Mobile Toolkit for Follow-Up Care of Psychiatric Patients",,"Completed","No Results Available","Suicide, Suicidal Ideation","Behavioral: Relief Link Application Daily Tasks","Change in scores on 6 item Columbia Suicide Severity Rating Scale Screener (C-SSRS)|Change in scores on 20-item Positive-Negative Affect Scale (PANAS)|Change in scores on 20-item R-UCLA Loneliness Scale|Change in scores on 14-item Mental Health Continuum Short Form (MHC-SF)|Change in scores on 12-item Flourishing Scale (FS)|Change in scores on 8-item Grit-S scale|Change in scores on 10-item Life Orientation Test - Revised|Change in scores on 25-item Connor Davidson Resilience Inventory|Change in scores on 21-item Posttraumatic Growth Inventory|11-item Effectiveness of Obtaining Resources scale (EOR)|Number of participants experiencing hospitalizations|Number of participants experiencing self-injury events|Number of participant reported barriers to care and resources|Participant adherence to assigned coping skills activities|Participant adherence to daily mood tracking|Participant usage of resource location functions|Participant positive feedback","Emory University|Georgia Tech Research Institute","All","18 Years to 64 Years   (Adult)","Not Applicable","13","Other","Interventional","Intervention Model: Single Group Assignment|Masking: None (Open Label)|Primary Purpose: Prevention","IRB00083066","April 2016","October 2017","October 2017","February 25, 2016","null","December 15, 2017","Grady Health System, Atlanta, Georgia, United States","","https://ClinicalTrials.gov/show/NCT02691221"
218,"NCT02690064","Mechanisms for Vascular Dysfunction and Exercise Tolerance in CF","CF-AOX","Recruiting","No Results Available","Cystic Fibrosis","Dietary Supplement: Acute Antioxidant Cocktail|Dietary Supplement: Chronic Antioxidant Cocktail|Other: Placebo","Acute Change in Flow mediated dilation|Chronic Change in Flow mediated dilation|Acute Change in exercise capacity (VO2 peak)|Chronic Change in exercise capacity (VO2 peak)|Acute Change in Biomarkers of oxidative stress|Acute Change in Arterial Stiffness|Chronic Change in Biomarkers of oxidative stress|Chronic Change in Arterial Stiffness","Augusta University","All","7 Years and older   (Child, Adult, Older Adult)","Not Applicable","80","Other","Interventional","Allocation: Randomized|Intervention Model: Crossover Assignment|Masking: Double (Participant, Investigator)|Primary Purpose: Treatment","CF-AOX","April 2015","December 2018","December 2018","February 24, 2016","null","January 10, 2018","Georgia Prevention Institute, Augusta, Georgia, United States","","https://ClinicalTrials.gov/show/NCT02690064"
219,"NCT02682940","T1 Diabetes Hypoglycemia Prevention Pilot",,"Terminated","No Results Available","Diabetes Mellitus, Type 1|Hypoglycemia","Device: Vigilant Diabetes Management Application","Aggregate reduction in the rate of mild hypoglycemia (biochemical and logged) as measured by meter or logged home blood glucose values <56 mg/dL at 3 months, compared to the monthly rate of hypoglycemia in the baseline period.|An aggregate reduction in the rate of biochemical severe hypoglycemia as measured by meter or logged home blood glucose values <40 mg/dL, at 3 months, compared to the monthly rate in the baseline period|An aggregate (total study population) reduction in the LBGI and HBGI, as measured by percent of readings in and out of range calculated based on downloaded blood glucose meter download data.|An aggregate reduction in average HbA1will be measured at baseline using DCA 2000 or equivalent NGSP-certified point-of-care method or local laboratory at 3 months, compared to HbA1c levels obtained at study initiation.|An aggregate reduction in the survey self-reported rate of use of; 1) Glucagon 2) Emergency medical services for hypoglycemia, and 3) Hospital, urgent care or clinic visits for hypoglycemia or associated with hypoglycemia care visits.|An aggregate reduction in the mean glycemic variability, as measured by monthly ADRR (Average Daily Risk Range), calculated based on downloaded meter download data|Reduction in reported fear of hypoglycemia as compared to baseline Fear of Hypoglycemia Fear Survey. The Hypoglycemia Fear Survey II (HSF II) will be used.|Improvement in self-reported lost work productivity as a result of hypoglycemia. Individuals will complete a questionnaire about lost work days as a result of hypoglycemia at baseline and at 3 months.|Improvement in self-reported psychosocial self-efficacy as compared to baseline measured using the Diabetes Empowerment Scale Short Form (DES-SF).","InSpark Technologies, Inc.|Atlanta Diabetes Associates","All","11 Years to 74 Years   (Child, Adult, Older Adult)","Not Applicable","4","Industry|Other","Interventional","Intervention Model: Single Group Assignment|Masking: None (Open Label)|Primary Purpose: Treatment","VG2HT1US1","May 2016","December 2016","December 2016","February 17, 2016","null","March 3, 2017","Atlanta Diabetes Associates, Atlanta, Georgia, United States","","https://ClinicalTrials.gov/show/NCT02682940"
220,"NCT02672579","Study of Kids Itch Severity (SKIS)","SKIS","Completed","No Results Available","Chronic Pruritus","","ItchyQoL (TotsItchyQoL) test-retest reliability|ItchyQoL (KidsItchyQoL) test-retest reliability|ItchyQoL (TotsItchyQoL) validity|ItchyQoL (KidsItchyQoL) validity|Psychometric properties of the ItchyQuant|Feasibility of harnessing an electronic platform as assessed by researcher judgement|Prevalence of ADHD symptoms","Emory University","All","4 Years to 17 Years   (Child)","","312","Other","Observational","Observational Model: Other|Time Perspective: Prospective","IRB00081076","May 2015","June 28, 2018","June 28, 2018","February 3, 2016","null","August 14, 2018","Emory University, Atlanta, Georgia, United States","","https://ClinicalTrials.gov/show/NCT02672579"
221,"NCT02669030","A Six Week, Randomized, Double-Blind Placebo-Controlled, Suvorexant Augmentation Study of Antidepressant Treatment of Major Depressive Disorder With Residual Insomnia",,"Unknown status","No Results Available","Depression|Major Depressive Disorder|MDD|Insomnia","Drug: suvorexant|Drug: Placebo","Total Sleep Time|Insomnia Severity Index (ISI)|Hamilton Depression Rating Scale|Sheehan Disability Scale|Wake After Sleep Onset (WASO)|Sleep Latency (SL)|Perceived Deficits Questionnaire (PDQ)","Institute for Advanced Medical Research, Alpharetta, GA|Jefferson Medical College of Thomas Jefferson University|Medical College of Georgia at Augusta University, Department of Psychiatry and Health Behavior, Augusta, GA","All","18 Years to 70 Years   (Adult, Older Adult)","Phase 4","74","Other","Interventional","Allocation: Randomized|Intervention Model: Parallel Assignment|Masking: Double (Participant, Investigator)|Primary Purpose: Treatment","SVX-IIT2016-001","February 2016","March 2017","null","January 29, 2016","null","January 29, 2016","Institute for Advanced Medical Research, Alpharetta, Georgia, United States","","https://ClinicalTrials.gov/show/NCT02669030"
222,"NCT02646579","Effects of Dry Needling Using Spinal and Peripheral Sites Versus Peripheral Sites Only",,"Recruiting","No Results Available","Plantar Fasciitis|Achilles Tendinitis|Patellofemoral Pain Syndrome","Procedure: Spinal and Peripheral Dry Needling|Procedure: Peripheral Dry Needling","Change in Pain Level assessed using the Visual Analogue Scale (VAS)|Change in Muscle Strength of Hip Abductors assessed using a dynamometer|Change in Muscle Strength of Knee Extensors/Flexors assessed using a dynamometer|Change in Muscle Strength of Ankle Dorsiflexors/Platarflexors assessed using a dynamometer|Change in Unilateral Hop Distance|Change in Single-limb Standing Balance Test Time","Emory University","All","18 Years to 65 Years   (Adult, Older Adult)","Not Applicable","34","Other","Interventional","Allocation: Randomized|Intervention Model: Parallel Assignment|Masking: Single (Outcomes Assessor)|Primary Purpose: Treatment","IRB00084277","October 27, 2017","December 2018","June 2019","January 5, 2016","null","August 15, 2018","The Emory Clinic, Atlanta, Georgia, United States","","https://ClinicalTrials.gov/show/NCT02646579"
223,"NCT02642510","Improving Patient Education for Lymphoma and Leukemia Inpatients",,"Completed","No Results Available","Leukemia|Lymphoma","Other: Structured Education DVD + Verbal Teaching|Other: Verbal Teaching","Quality of Discharge Teaching Scale (QDTS) Score|Visual analog scale (VAS) Score","Emory University","All","18 Years and older   (Adult, Older Adult)","Not Applicable","78","Other","Interventional","Allocation: Randomized|Intervention Model: Single Group Assignment|Masking: None (Open Label)|Primary Purpose: Other","IRB00073387","June 2014","February 20, 2017","February 20, 2017","December 30, 2015","null","June 22, 2017","Emory University Hospital, Atlanta, Georgia, United States","","https://ClinicalTrials.gov/show/NCT02642510"
